"57","rand","10118612974022026353",73,"Camacho-Toledano, C. and Mach<c3><ad>n-D<c3><ad>az, I. and Calahorra, L. and Caba<c3><b1>as-Cotillas, M. and Otaegui, D. and Castillo-Trivi<c3><b1>o, T. and Villar, L. M. and Costa-Frossard, L. and Comabella, M. and Midaglia, L. and Garc<c3><ad>a-Dom<c3><ad>nguez, J. M. and Garc<c3><ad>a-Arocha, J. and Ortega, M. C. and Clemente, D.",2022,"J Neuroinflammation","Peripheral myeloid-derived suppressor cells are good biomarkers of the efficacy of fingolimod in multiple sclerosis","BACKGROUND: The increasing number of treatments that are now available to manage patients with multiple sclerosis (MS) highlights the need to develop biomarkers that can be used within the framework of individualized medicine. Fingolimod is a disease-modifying treatment that belongs to the sphingosine-1-phosphate receptor modulators. In addition to inhibiting T cell egress from lymph nodes, fingolimod promotes the immunosuppressive activity of myeloid-derived suppressor cells (MDSCs), whose monocytic subset (M-MDSCs) can be used as a biomarker of disease severity, as well as the degree of demyelination and extent of axonal damage in the experimental autoimmune encephalomyelitis (EAE) model of MS. In the present study, we have assessed whether the abundance of circulating M-MDSCs may represent a useful biomarker of fingolimod efficacy in EAE and in the clinical context of MS patients. METHODS: Treatment with vehicle or fingolimod was orally administered to EAE mice for 14<c2><a0>days in an individualized manner, starting the day when each mouse began to develop clinical signs. Peripheral blood from EAE mice was collected previous to treatment and human peripheral blood mononuclear cells (PBMCs) were collected from fingolimod to treat MS patients' peripheral blood. In both cases, M-MDSCs abundance was analyzed by flow cytometry and its relationship with the future clinical affectation of each individual animal or patient was assessed. RESULTS: Fingolimod-treated animals presented a milder EAE course with less demyelination and axonal damage, although a few animals did not respond well to treatment and they invariably had fewer M-MDSCs prior to initiating the treatment. Remarkably, M-MDSC abundance was also found to be an important and specific parameter to distinguish EAE mice prone to better fingolimod efficacy. Finally, in a translational effort, M-MDSCs were quantified in MS patients at baseline and correlated with different clinical parameters after 12<c2><a0>months of fingolimod treatment. M-MDSCs at baseline were highly representative of a good therapeutic response to fingolimod, i.e., patients who met at least two of the criteria used to define non-evidence of disease activity-3 (NEDA-3) 12<c2><a0>months after treatment. CONCLUSION: Our data indicate that M-MDSCs might be a useful predictive biomarker of the response of MS patients to fingolimod.","no",NA,"IEB",1,NA,"EAE","mouse","C57BL/6","female","7","Fingolimod","control",1,NA,"2",0.95,18,0.2,2.15,19,0.2,NA,NA,NA,NA,NA,NA,NA,NA,NA,"data type probably ""mean, SEM"", however not clear since it was not written in legend of that figure.",NA,NA,NA,NA,NA,NA,NA,NA,NA,NA,NA,NA,NA,NA,NA,NA,NA,NA,NA,NA,NA,NA,NA,NA,NA,NA,NA,NA,NA,NA,NA,NA,NA,NA,NA,NA,NA,NA,NA,NA,NA,NA,NA,NA,NA,NA,"mouse","Marketed",NA,"","","","","","","","","","",NA,NA,NA,"EAE","113","not reported","0","mice","63","mouse","12","female","histology","behaviour","imaging","yes","Manual check recommended","not reported","No manual check required","yes","Manual check recommended","yes","No manual check required","not reported","No manual check required","not reported","No manual check required","yes",NA,"dclemente@sescam.jccm.es","11","1","164","350","877","164 - 877","1 - 1507"
"58","rand","10118613041023010475",493,"S. Li; K. Sakurai; M. Ohgidani; T. A. Kato; T. Hikida",2023,"Mol Brain","Ameliorative effects of Fingolimod (FTY720) on microglial activation and psychosis-related behavior in short term cuprizone exposed mice","Schizophrenia is a psychiatric disorder that affects around 1% of the population in widespread populations, with severe cases leading to long-term hospitalization and necessitation of lifelong treatment. Recent studies on schizophrenia have highlighted the involvement of inflammatory and immunoregulatory mechanisms with the onset of symptoms, and the usage of anti-inflammatory treatments are being tested against periods of rapid psychosis. In the central nervous system, microglia are the innate immune population which are activated in response to a wide range of physical and psychological stress factors and produce proinflammatory mediators such as cytokines. Microglial activation and neuroinflammation has been associated to numerous psychiatric disorders including schizophrenia, especially during psychotic episodes. Thus, novel treatments which dampen microglial activation may be of great relevance in the treatment of psychiatric disorders. Fingolimod (FTY720) is a drug used as an immunosuppressive treatment to multiple sclerosis. Recent clinical trials have focused on FTY720 as a treatment for the behavioral symptoms in schizophrenia. However, the mechanisms of Fingolimod in treating the symptoms of schizophrenia are not clear. In this study we use a recently developed neuroinflammatory psychosis model in mice: cuprizone short-term exposure, to investigate the effects of FTY720 administration. FTY720 administration was able to completely alleviate methamphetamine hypersensitivity caused by cuprizone exposure. Moreover, administration of FTY720 improved multiple measures of neuroinflammation (microglial activation, cytokine production, and leucocyte infiltration). In conclusion, our results highlight the future use of FTY720 as a direct anti-inflammatory treatment against microglial activation and psychosis.","no",NA,"BVI",1,NA,"cuprizone","mouse","C57BL/6","male","7","Fingolimod","control",1,NA,"1",NA,NA,NA,NA,NA,NA,NA,NA,NA,NA,NA,NA,NA,NA,NA,NA,NA,NA,NA,NA,NA,NA,NA,NA,NA,NA,NA,NA,NA,NA,NA,NA,NA,NA,NA,NA,NA,NA,NA,NA,NA,NA,NA,NA,NA,NA,NA,NA,NA,NA,NA,NA,NA,NA,NA,NA,NA,NA,NA,NA,NA,NA,NA,"Marketed",NA,"unclear","unclear","unclear","unclear","unclear","low","unclear","unclear","unclear","low",NA,"2011",NA,"cuprizone","14","not reported","0","mice","13","mouse","4","male","histology","behaviour","not reported","yes","No manual check required","not reported","No manual check required","yes","Manual check recommended","yes","Manual check recommended","not reported","No manual check required","not reported","No manual check required","yes",NA,"c(""ksakurai@protein.osaka-u.ac.jp"", ""kato.takahiro.015@m.kyushu-u.ac.jp"", ""hikida@protein.osaka-u.ac.jp"")","8","56","509","143","317","509 - 851","1 - 1055"
"59","rand","1011861355002200878y",432,"Vainio, S. K. and Dickens, A. M. and Matilainen, M. and L<c3><b3>pez-Pic<c3><b3>n, F. R. and Aarnio, R. and Eskola, O. and Solin, O. and Anthony, D. C. and Rinne, J. O. and Airas, L. and Haaparanta-Solin, M.",2022,"EJNMMI Res","Dimethyl fumarate decreases short-term but not long-term inflammation in a focal EAE model of neuroinflammation","BACKGROUND: Dimethyl fumarate (DMF) is an oral immunomodulatory drug used in the treatment of autoimmune diseases. Here, we sought to study whether the effect of DMF can be detected using positron emission tomography (PET) targeting the 18-kDa translocator protein (TSPO) in the focal delayed-type hypersensitivity rat model of multiple sclerosis (fDTH-EAE). The rats were treated orally twice daily from lesion activation (day 0) with either vehicle (tap water with 0.08% Methocel, 200 <c2><b5>L; control group n<e2><80><89>=<e2><80><89>4 (3 after week four)) or 15<c2><a0>mg/kg DMF (n<e2><80><89>=<e2><80><89>4) in 0.08% aqueous Methocel (200 <c2><b5>L) for 8<c2><a0>weeks. The animals were imaged by PET using the TSPO tracer [(18)F]GE-180 in weeks 0, 1, 2, 4, 8, and 18 following lesion activation, and the non-displaceable binding potential (BP(ND)) was calculated. Immunohistochemical staining for Iba1, CD4, and CD8 was performed in week 18, and in separate cohorts of animals, following 2 or 4<c2><a0>weeks of treatment. RESULTS: Using the fDTH-EAE model, DMF reduced the [(18)F]GE-180 BP(ND) in the DMF-treated animals compared to control animals after 1<c2><a0>week of treatment (two-tailed unpaired t test, p<e2><80><89>=<e2><80><89>0.031), but not in weeks 2, 4, 8, or 18 when imaged in vivo by PET. Immunostaining for Iba1 showed that DMF had no effect on the perilesional volume or the core lesion volume after 2 or 4<c2><a0>weeks of treatment, or at 18<c2><a0>weeks. However, the optical density (OD) measurements of CD4(+) staining showed reduced OD in the lesions of the treated rats. CONCLUSIONS: DMF reduced the microglial activation in the fDTH-EAE model after 1<c2><a0>week of treatment, as detected by PET imaging of the TSPO ligand [(18)F]GE-180. However, over an extended time course, reduced microglial activation was not observed using [(18)F]GE-180 or by immunohistochemistry for Iba1(+) microglia/macrophages. Additionally, DMF did affect the infiltration of CD4(+) and CD8(+) T-lymphocytes at the fDTH-EAE lesion.","no",NA,"PH",1,NA,"EAE","rat","Lewis","male",NA,"Dimethyl fumarate","control",1,24,"1",NA,NA,NA,NA,NA,NA,NA,NA,NA,NA,NA,NA,NA,NA,NA,NA,NA,NA,NA,NA,NA,NA,NA,NA,NA,NA,NA,NA,NA,NA,NA,NA,NA,NA,NA,NA,NA,NA,NA,NA,NA,NA,NA,NA,NA,NA,NA,NA,NA,NA,NA,NA,NA,NA,NA,NA,NA,NA,NA,NA,NA,NA,"rat","Marketed",NA,"","","","","","","","","","",NA,NA,"y","not reported","0","not reported","0","rats","8","rabbit","1","male","histology","not reported","not reported","yes","No manual check required","not reported","No manual check required","yes","Manual check recommended","yes","Manual check recommended","not reported","No manual check required","yes","No manual check required","yes",NA,"sukakoi@utu.fi","9","1","101","192","448","101 - 448","1 - 881"
"60","rand","1011911352458503m963oa",420,"Teitelbaum, D. and Brenner, T. and Abramsky, O. and Aharoni, R. and Sela, M. and Arnon, R.",2003,"Mult Scler","Antibodies to glatiramer acetate do not interfere with its biological functions and therapeutic efficacy","Glatiramer acetate (GA) previously known as Copolymer 1 (Cop 1), a synthetic amino acid copolymer, suppresses experimental autoimmune encephalomyelitis (EAE) and shows a beneficial effect in relapsing-remitting type of multiple sclerosis (MS). GA acts as a specific immunomodulator by binding to MHC Class II molecules, inducing specific T suppressor (Ts) cells and interfering with T cell responses to myelin antigens. MS patients treated with GA developed GA reactive antibodies, which peaked at three months and decreased at six months. In order to find out whether anti-GA antibodies may neutralize the therapeutic effect of GA, we tested both polyclonal (mouse and human) and monoclonal GA specific antibodies for their ability to interfere with the biological activity of GA in several assay systems. None of the antibodies interfered with GA activities either in vitro (binding to MHC molecules and T cell stimulation) or in vivo (blocking of EAE). Furthermore, 53 samples of sera obtained from 34 MS patients that participated in the open label trial in Israel, and all developed GA specific antibodies, were tested for their ability to inhibit the proliferation response of GA specific Ts cell clone and to interfere with GA competitive inhibition of the response to peptide 84-102 of myelin basic protein (MBP). None of the sera inhibited and some even enhanced the in vitro activities of GA. Furthermore, representative MS sera with high titer of GA reactive antibodies did not neutralize the biological activities of GA and did not inhibit Th2 cytokine secretion by human GA specific clone. These results are consistent with the findings that the therapeutic effect of GA is not affected by GA reactive antibodies and is sustained upon long term treatment.","no",NA,"PH",1,NA,"EAE","mouse","(SJLxBALB/c)F1","female","9.5","Glatiramer acetate","control",1,NA,"1",NA,NA,NA,NA,NA,NA,NA,NA,NA,NA,NA,NA,NA,NA,NA,NA,NA,NA,NA,NA,NA,NA,NA,NA,NA,NA,NA,NA,NA,NA,NA,NA,NA,NA,NA,NA,NA,NA,NA,NA,NA,NA,NA,NA,NA,NA,NA,NA,NA,NA,NA,NA,NA,NA,NA,NA,NA,NA,NA,NA,NA,NA,"mouse","Marketed",NA,"","","","","","","","","","",NA,"2003",NA,"EAE","24","experimental autoimmune encephalomyelitis","1","mice","16","mouse","5","female","not reported","behaviour","imaging","yes","Manual check recommended","not reported","No manual check required","yes","No manual check required","not reported","No manual check required","not reported","No manual check required","not reported","No manual check required","not reported","10 3159/835","dvora.teitelbaum@weizmann.ac.il","1","31","120","157","33","120 - 494","1 - 561"
"61","rand","1011911352458504m1090oa",105,"Deloire, M. S. and Touil, T. and Brochet, B. and Dousset, V. and Caill<c3><a9>, J. M. and Petry, K. G.",2004,"Mult Scler","Macrophage brain infiltration in experimental autoimmune encephalomyelitis is not completely compromised by suppressed T-cell invasion: in vivo magnetic resonance imaging illustration in effective anti-VLA-4 antibody treatment","Large inflammatory infiltrates of T cells, macrophages and B cells in the central nervous system (CNS) contribute to the pathogenesis of multiple sclerosis (MS). The passage of T cells through the blood-brain barrier can be suppressed with antibodies directed against alpha-4 integrins (VLA-4) that mediate T-cell adherence. This treatment, in phase III of clinical trial evaluation, reduces lesion development in MS patients. In the ongoing inflammatory disease process the consequences of T-cell inhibitory anti-VLA-4 antibodies on inflammatory compounds are still poorly investigated. We show that anti-VLA-4 antibody treatment during the late preclinical phase of the acute experimental autoimmune encephalomyelitis (EAE) MS rat model interrupts T-cell egress out of the vascular compartment and suppresses clinical disease and histological alterations but macrophage recruitment in the CNS is not fully compromised. Among the treated EAE animals not developing disease, none presented foci of T-cell infiltration in CNS. However, in 75% of the treated EAE rats monocyte ingress in CNS was observed in vivo by magnetic resonance imaging with the ultrasmall superparamagnetic iron oxide contrast agent. Our data shed new light on the role of remaining macrophage brain infiltration in an induced but interrupted T-cell-mediated EAE disease process.","no",NA,"IEB",1,NA,"EAE","rat","Lewis","female","6.5","Natalizumab","control",1,NA,"1",0.4,8,0.5,2.3,7,1.6,"mean, SD",5.76,8,5.17,16.76,7,7.83,"mean, SD","brain volume","Natalizumab is also a anti-VLA-4 antibody; EAE score values --> taken from a table showing maximum clinical score, not necessarily largest effect size (since no such graph was available); MRI volume: ""MRI volume indicates the volume in mm3 of MRI signal alterations determined on T1 wi sagittal slices per animal (mean (SD))""; MRI load: ""MRI load indicates the number of positive MRI signal alterations per animal (mean (SD))""",NA,NA,NA,NA,NA,NA,NA,NA,NA,NA,NA,NA,NA,NA,NA,NA,NA,NA,NA,NA,NA,2.5,8,2.2,3.43,7,2.2,"mean, SD","",NA,NA,NA,NA,NA,NA,NA,NA,NA,NA,NA,NA,NA,NA,NA,NA,NA,"rat","Marketed",NA,"unclear","unclear","unclear","unclear","unclear","low","unclear","unclear","unclear","low",NA,NA,NA,"EAE","44","not reported","0","rats","27","mouse","5","female","histology","behaviour","imaging","yes","Manual check recommended","not reported","No manual check required","yes","No manual check required","not reported","No manual check required","not reported","No manual check required","not reported","No manual check required","not reported",NA,"klaus.petry@bordeaux.INSERM.fr","1","24","101","212","353","101 - 353","1 - 620"
"62","rand","101371journalpone0110819",450,"Yamamoto, R. and Okada, Y. and Hirose, J. and Koshika, T. and Kawato, Y. and Maeda, M. and Saito, R. and Hattori, K. and Harada, H. and Nagasaka, Y. and Morokata, T.",2014,"PLoS One","ASP4058, a novel agonist for sphingosine 1-phosphate receptors 1 and 5, ameliorates rodent experimental autoimmune encephalomyelitis with a favorable safety profile","Sphingosine-1-phosphate (S1P) is a biologically active sphingolipid that acts through the members of a family of five G protein-coupled receptors (S1P1-S1P5). S1P1 is a major regulator of lymphocyte trafficking, and fingolimod, whose active metabolite fingolimod phosphate acts as a nonselective S1P receptor agonist, exerts its immunomodulatory effect, at least in part, by regulating the lymphocyte trafficking by inducing down regulation of lymphocyte S1P1. Here, we detail the pharmacological profile of 5-{5-[3-(trifluoromethyl)-4-{[(2S)-1,1,1-trifluoropropan-2-yl]oxy}phenyl]-1,2,4-oxadiazol-3-yl}-1H-benzimidazole (ASP4058), a novel next-generation S1P receptor agonist selective for S1P1 and S1P5. ASP4058 preferentially activates S1P1 and S1P5 compared with S1P2, 3, 4 in GTP<ce><b3>S binding assays in vitro. Oral administration of ASP4058 reduced the number of peripheral lymphocytes and inhibited the development of experimental autoimmune encephalomyelitis (EAE) in Lewis rats. Further, ASP4058 prevented relapse of disease in a mouse model of relapsing-remitting EAE. Although these immunomodulatory effects were comparable to those of fingolimod, ASP4058 showed a wider safety margin than fingolimod for bradycardia and bronchoconstriction in rodents. These observations suggest that ASP4058 represents a new therapeutic option for treating multiple sclerosis that is safer than nonselective S1P receptor agonists such as fingolimod.","no",NA,"PH",1,NA,"EAE","rat","Lewis","both",NA,"Fingolimod","control",1,NA,"1,2",0,6,0,3.3,6,0.2,"mean, SEM",NA,NA,NA,NA,NA,NA,NA,NA,"EAE Scores from prophylactic regimen, as there were no Score Data of the therapeutic regimen",NA,NA,NA,NA,NA,NA,NA,NA,NA,NA,NA,NA,NA,NA,NA,NA,NA,NA,NA,NA,NA,NA,NA,NA,NA,NA,NA,NA,NA,NA,NA,NA,NA,NA,NA,NA,NA,NA,NA,NA,NA,NA,NA,NA,NA,NA,"rat","Marketed",NA,"unclear","unclear","unclear","unclear","unclear","low","unclear","unclear","unclear","high",NA,NA,NA,"EAE","12","not reported","0","rats","36","mice","7","female and male","not reported","behaviour","not reported","yes","Manual check recommended","not reported","No manual check required","yes","Manual check recommended","yes","Manual check recommended","not reported","No manual check required","not reported","No manual check required","yes","10.1371/journal.pone.0110819.g001","tatsuaki.morokata@astellas.com","9","36","94","319","490","94 - 490","1 - 771"
"63","rand","101371journalpone0144084",385,"Sloka, S. and Zhornitsky, S. and Silva, C. and Metz, L. M. and Yong, V. W.",2015,"PLoS One","1,25-Dihydroxyvitamin D3 Protects against Immune-Mediated Killing of Neurons in Culture and in Experimental Autoimmune Encephalomyelitis","Several studies have reported that low vitamin D levels are associated with an increased risk of developing multiple sclerosis (MS). As MS is an inflammatory disorder with degeneration of axons and neurons, we examined whether the biologically active form of vitamin D, 1,25-dihydroxyvitamin D3 (1,25D3), could protect against the T cell-mediated killing of human neurons in culture, and the axonal loss seen in mice with experimental autoimmune encephalomyelitis (EAE). Human neurons were exposed to activated human T lymphocytes and the loss of neurons was documented 24 hours later by counting the number of microtubule-associated protein-2 positive cells. Mice with EAE were harvested for counts of axonal profiles in the spinal cord. 1,25D3 was exposed to T cells in culture or administered to mice from peak EAE clinical severity when axonal loss was already evolving. Activated T lymphocytes killed human neurons prominently within 24 hours but toxicity was significantly attenuated when T cells were exposed to 1,25D3 prior to the co-culture. In EAE, 1,25D3 treatment initiated from peak clinical severity reduced the extent of clinical disability and mitigated the progressive loss of axons. The reduction of axonal and neuronal loss by 1,25D3 in the context of an inflammatory assault to the central nervous system is a potential contributor to the putative benefits of vitamin D in MS.","no",NA,"PH",1,NA,"EAE","mouse","C57BL/6","female","8.5","Vitamin D3","control",1,36,"2",4.3,16,0.8,7.5,16,0.5,"mean, SD",NA,NA,NA,NA,NA,NA,NA,NA,NA,NA,NA,NA,NA,NA,NA,NA,NA,NA,NA,NA,NA,NA,NA,NA,NA,NA,NA,NA,NA,NA,NA,NA,NA,NA,NA,NA,NA,NA,NA,NA,NA,NA,NA,NA,NA,NA,NA,NA,NA,NA,NA,NA,NA,NA,NA,"mouse","Failed",NA,"","","","","","","","","","",NA,NA,NA,"EAE","19","not reported","0","mice","40","mouse","8","female","histology","behaviour","not reported","yes","Manual check recommended","not reported","No manual check required","yes","Manual check recommended","yes","Manual check recommended","not reported","No manual check required","not reported","No manual check required","yes","10.1371/journal.pone.0144084",NA,"40","57","91","89","363","91 - 363","1 - 517"
"64","rand","1018632oncotarget8981",410,"Sun, J. and Zhou, H. and Bai, F. and Ren, Q. and Zhang, Z.",2016,"Oncotarget","Myelin injury induces axonal transport impairment but not AD-like pathology in the hippocampus of cuprizone-fed mice","Both multiple sclerosis (MS) and Alzheimer's disease (AD) are progressive neurological disorders with myelin injury and memory impairment. However, whether myelin impairment could cause AD-like neurological pathology remains unclear. To explore neurological pathology following myelin injury, we assessed cognitive function, the expression of myelin proteins, axonal transport-associated proteins, axonal structural proteins, synapse-associated proteins, tau and beta amyloid and the status of neurons, using the cuprizone mouse model of demyelination. We found the mild impairment of learning ability in cuprizone-fed mice and the decreased expression of myelin basic protein (MBP) in the hippocampus. And anti-LINGO-1 improved learning ability and partly restored MBP level. Furthermore, we also found kinesin light chain (KLC), neurofilament light chain (NFL) and neurofilament heavy chain (NF200) were declined in demyelinated hippocampus, which could be partly improved by treatment with anti-LINGO-1. However, we did not observe the increased expression of beta amyloid, hyperphosphorylation of tau and loss of neurons in demyelinated hippocampus. Our results suggest that demyelination might lead to the impairment of neuronal transport, but not cause increased level of hyperphosphorylated tau and beta amyloid. Our research demonstrates remyelination might be an effective pathway to recover the function of neuronal axons and cognition in MS.","no",NA,"PH",1,NA,"cuprizone","mouse","C57BL/6","male","8","Opicinumab","control",3,51,NA,NA,NA,NA,NA,NA,NA,NA,NA,NA,NA,NA,NA,NA,NA,NA,NA,NA,NA,NA,NA,NA,NA,NA,NA,NA,NA,NA,NA,NA,NA,NA,NA,NA,NA,NA,NA,NA,NA,NA,NA,NA,NA,NA,NA,NA,NA,NA,NA,NA,NA,NA,NA,NA,NA,NA,NA,NA,NA,NA,NA,NA,NA,"mouse","Failed",NA,"","","","","","","","","","",NA,NA,NA,"cuprizone","1","not reported","0","mice","18","rabbit","16","male","histology","behaviour","not reported","yes","No manual check required","not reported","No manual check required","yes","Manual check recommended","yes","Manual check recommended","not reported","No manual check required","not reported","No manual check required","not reported",NA,NA,"10","30","361","40","240","361 - 561","1 - 780"
