"113","blind","101016jjneuroim201808007",290,"Moriguchi, K. and Miyamoto, K. and Fukumoto, Y. and Kusunoki, S.",2018,"J Neuroimmunol","4-Aminopyridine ameliorates relapsing remitting experimental autoimmune encephalomyelitis in SJL/J mice","We evaluated the effects of a non-specific potassium channel blocker, 4-aminopyridine (4-AP), on chronic experimental autoimmune encephalomyelitis (chEAE) and relapsing remitting EAE (rrEAE) in mice. 4-AP did not affect chEAE, but ameliorated rrEAE, particularly in the relapsing phase. Disease amelioration was confirmed pathologically, and glial fibrillary acidic protein expression was observed to be downregulated in 4-AP-treated mice. In the recall response, a T-cell proliferative response was not inhibited; however, Th1/Th17 polarization was attenuated. 4-AP is currently accepted as an anti-symptomatic drug only in the chronic phase of multiple sclerosis (MS); however, its use in the active phase of MS should be considered.","no",NA,"WZ",1,NA,"EAE","mouse","C57BL/6, SJL","female","12","Fampridine","control",1,67,"1",0.3,25,0.1,2,21,0.5,"mean, SEM",NA,NA,NA,NA,NA,NA,NA,NA,"Clinical scores are from rrEAE, female SJL/J mice",NA,NA,NA,NA,NA,NA,NA,NA,NA,NA,NA,NA,NA,NA,NA,NA,NA,NA,NA,NA,NA,NA,NA,NA,NA,NA,NA,NA,NA,NA,NA,NA,NA,NA,NA,NA,NA,NA,NA,NA,NA,NA,NA,NA,NA,NA,"mouse","Marketed",NA,"","","","","","","","","","",NA,NA,NA,"EAE","10","not reported","0","mice","29","rat","2","female","histology","behaviour","not reported","not reported","No manual check required","yes","No manual check required","yes","No manual check required","not reported","No manual check required","not reported","No manual check required","not reported","No manual check required","not reported",NA,"miyamoto@med.kindai.ac.jp","15","23","59","164","310","59 - 310","1 - 412"
"114","blind","101016jjneuroim201812010",107,"Demir, S. and Pitarokoili, K. and Linker, R. and Gold, R.",2019,"J Neuroimmunol","Immune cell derived BDNF does not mediate neuroprotection of the murine anti-CD52 antibody in a chronic autoimmune mouse model","The murine anti-CD52 antibody, an equivalent of the humanized antibody alemtuzumab, which is successfully used in the treatment of multiple sclerosis, was used to explore a potential neuroprotective effect driven by immune cell derived brain-derived neurotrophic factor (BDNF). Therefore, lineage specific constitutive knock-out mice with a BDNF deficiency in T cells and macrophages were used and compared to treated wildtype mice. Neither therapeutic nor preventive application of the murine anti-CD52 antibody in an animal model of multiple sclerosis, the MOG(35-55) EAE, revealed a beneficial contribution of immune cell derived BDNF to the disease outcome. Furthermore, preventive application of the murine anti-CD52 antibody worsened the clinical EAE disease course and could only be overcome by a prolonged recovery phase after treatment and before disease induction.","no",NA,"IEB",1,NA,"EAE","mouse","C57BL/6",NA,NA,"Alemtuzumab","control",3,NA,"0,2",1.1,25,0.35,4.6,22,0.65,"mean, SEM",NA,NA,NA,NA,NA,NA,NA,NA,"drug was called murine anti-CD52 antibody (synonym for Alemtuzumab?)",NA,NA,NA,NA,NA,NA,NA,NA,NA,NA,NA,NA,NA,NA,NA,NA,NA,NA,NA,NA,NA,NA,NA,NA,NA,NA,NA,NA,NA,NA,NA,NA,NA,NA,NA,NA,NA,NA,NA,NA,NA,NA,NA,NA,NA,NA,"mouse","Marketed",NA,"","","","","","","","","","",NA,NA,NA,"EAE","17","not reported","0","mice","51","mouse","6","not reported","histology","behaviour","not reported","not reported","No manual check required","yes","Manual check recommended","yes","Manual check recommended","not reported","No manual check required","not reported","No manual check required","not reported","No manual check required","not reported",NA,"Kalliopi.Pitarokoili@ruhr-uni-bochum.de","13","26","68","79","354","68 - 354","1 - 554"
"115","blind","101016jjneuroim2019577091",312,"Nystad, A. E. and Lereim, R. R. and Wergeland, S. and Oveland, E. and Myhr, K. M. and B<c3><b8>, L. and Torkildsen, <c3><98>",2020,"J Neuroimmunol","Fingolimod downregulates brain sphingosine-1-phosphate receptor 1 levels but does not promote remyelination or neuroprotection in the cuprizone model","Fingolimod is used to treat patients with relapsing-remitting multiple sclerosis; it crosses the blood-brain barrier and modulates sphingosine-1-phosphate receptors (S1PRs). Oligodendrocytes, astrocytes, microglia, and neuronal cells express S1PRs, and fingolimod could potentially improve remyelination and be neuroprotective. We used the cuprizone animal model, histo-, immunohistochemistry, and quantitative proteomics to study the effect of fingolimod on remyelination and axonal damage. Fingolimod was functionally active during remyelination by downregulating S1PR1 brain levels, and fingolimod-treated mice had more oligodendrocytes in the secondary motor cortex after three weeks of remyelination. However, there were no differences in remyelination or axonal damage compared to placebo. Thus, fingolimod does not seem to directly promote remyelination or protect against axonal injury or loss when given after cuprizone-induced demyelination.","no",NA,"WZ",1,NA,"cuprizone","mouse","C57BL/6","female","5","Fingolimod","control",1,48,"2",NA,NA,NA,NA,NA,NA,NA,NA,NA,NA,NA,NA,NA,NA,NA,NA,NA,NA,NA,NA,NA,NA,NA,NA,NA,NA,NA,NA,NA,NA,NA,NA,NA,NA,NA,NA,NA,NA,NA,NA,NA,NA,NA,NA,NA,NA,NA,NA,NA,NA,NA,NA,NA,NA,NA,NA,NA,NA,NA,NA,NA,NA,"mouse","Marketed",NA,"","","","","","","","","","",NA,NA,NA,"cuprizone","11","not reported","0","mice","26","mouse","3","female","histology","not reported","not reported","not reported","No manual check required","yes","Manual check recommended","yes","No manual check required","not reported","No manual check required","yes","Manual check recommended","not reported","No manual check required","not reported",NA,"agnes.elisabeth.nystad@helse-bergen.no","21","34","64","37","365","64 - 365","1 - 856"
"116","blind","101016jjneuroim2022577926",210,"Kasheke, G. D. S. and Holman, S. P. and Robertson, G. S.",2022,"J Neuroimmunol","Fingolimod attenuates gait deficits in mice subjected to experimental autoimmune encephalomyelitis","Fingolimod, used to treat relapsing-remitting multiple sclerosis (RRMS), reduces motor deficits in mice with established experimental autoimmune encephalomyelitis (EAE). To better characterize the therapeutic effects of fingolimod, kinematic gait analysis was employed to precisely measure movements of a hindleg while EAE mice walked on a treadmill. Relative to the vehicle group, oral dosing with fingolimod, beginning after disease onset (1<c2><a0>mg/kg/day), increased hip heights and knee joint movements, and reduced spinal cord demyelination. These findings suggest that fingolimod preserves gait in RRMS patients by protecting motor circuits in the spinal cord.","no",NA,"WZ",1,NA,"EAE","mouse","C57BL/6","female",NA,"Fingolimod","control",1,22,"2",0.7,11,0.6,2,11,1.1,"mean, SD",NA,NA,NA,NA,NA,NA,NA,NA,"age: adult",NA,NA,NA,NA,NA,NA,NA,NA,NA,NA,NA,NA,NA,NA,NA,NA,NA,NA,NA,NA,NA,NA,NA,NA,NA,NA,NA,NA,NA,NA,NA,NA,NA,NA,NA,NA,NA,NA,NA,NA,NA,NA,NA,NA,NA,NA,"mouse","Marketed",NA,"","","","","","","","","","",NA,NA,NA,"EAE","18","experimental autoimmune encephalomyelitis","1","mice","16","mouse","5","female","histology","behaviour","not reported","not reported","No manual check required","yes","No manual check required","yes","No manual check required","yes","No manual check required","not reported","No manual check required","not reported","No manual check required","not reported","10.1016/j.jneuroim.2022.577926","c(""Gracious.Kasheke@dal.ca"", ""George.Robertson@dal.ca"")","15","23","33","228","239","33 - 239","1 - 326"
"117","blind","101016jmard201611010",232,"Kulkarni, P. and Yellanki, S. and Medishetti, R. and Sriram, D. and Saxena, U. and Yogeeswari, P.",2017,"Mult Scler Relat Disord","Novel Zebrafish EAE model: A quick in vivo screen for multiple sclerosis","INTRODUCTION: Pre-clinical drug discovery for multiple sclerosis (MS) is a labor intensive activity to perform in rodent models. This is owing to the long duration of disease induction and observation of treatment effects in an experimental autoimmune encephalomyelitis (EAE) model. We propose a novel adult zebrafish based model which offers a quick and simple protocol that can used to screen candidates as a step between in vitro experiments and rodent studies. The experiments conducted for this manuscript were to standardize a suitable model of EAE in adult zebrafish and validate it using known modulators. METHODS: The EAE model was developed by disease induction with myelin oligodendrocyte glycoprotein - 35-55 (MOG) and observation of survival, clinical signs and body weight changes. We have validated this model using fingolimod. We have further performed detailed validation using dimethyl fumarate, dexamethasone and SR1001, which are known modulators of rodent EAE. RESULTS: The immunization dose for the disease induction was observed to be 0.6mg/ml of MOG in CFA (Complete Freund's adjuvant), injected subcutaneously (s.c.) near spinal vertebrae. In the validation study with fingolimod, we have demonstrated the modulation of disease symptoms, which were also confirmed by histopathological evaluation. Furthermore, detailed validation with three other known drugs showed that our observations concur with those reported in conventional rodent models. DISCUSSION: We have standardized and validated the adult zebrafish EAE model. This model can help get a quick idea of in vivo activity of drugs in a week using very low quantities of candidate compounds. Further work will be required to define this model particularly as it is found that zebrafish may not express a MOG homologue.","no",NA,"WZ",1,NA,"EAE","zebrafish",NA,NA,"20","Fingolimod","control",NA,144,"1,2",1.1,12,0.1,3.8,12,0.1,"mean, SEM",NA,NA,NA,NA,NA,NA,NA,NA,NA,NA,NA,NA,NA,NA,NA,NA,NA,NA,NA,NA,NA,NA,NA,NA,NA,NA,NA,NA,NA,NA,NA,NA,NA,NA,NA,NA,NA,NA,NA,NA,NA,NA,NA,NA,NA,NA,NA,NA,NA,NA,NA,NA,NA,NA,NA,"zebrafish","Marketed",NA,"","","","","","","","","","",NA,NA,NA,"EAE","17","not reported","0","mouse","2","mice","2","not reported","histology","behaviour","not reported","not reported","No manual check required","yes","Manual check recommended","yes","Manual check recommended","yes","Manual check recommended","yes","No manual check required","not reported","No manual check required","not reported","10.1016/j.msard.2016.11.010.",NA,"121","17","94","70","35","94 - 465","1 - 582"
"118","blind","101016jnbd200610022",255,"Maier, K. and Merkler, D. and Gerber, J. and Taheri, N. and Kuhnert, A. V. and Williams, S. K. and Neusch, C. and B<c3><a4>hr, M. and Diem, R.",2007,"Neurobiol Dis","Multiple neuroprotective mechanisms of minocycline in autoimmune CNS inflammation","Axonal destruction and neuronal loss occur early during multiple sclerosis, an autoimmune inflammatory CNS disease that frequently manifests with acute optic neuritis. Available therapies mainly target the inflammatory component of the disease but fail to prevent neurodegeneration. To investigate the effect of minocycline on the survival of retinal ganglion cells (RGCs), the neurons that form the axons of the optic nerve, we used a rat model of myelin oligodendrocyte glycoprotein (MOG)-induced experimental autoimmune encephalomyelitis. Optic neuritis in this model was diagnosed by recording visual evoked potentials and RGC function was monitored by measuring electroretinograms. Functional and histopathological data of RGCs and optic nerves revealed neuronal and axonal protection when minocycline treatment was started on the day of immunization. Furthermore, we demonstrate that minocycline-induced neuroprotection is related to a direct antagonism of multiple mechanisms leading to neuronal cell death such as the induction of anti-apoptotic intracellular signalling pathways and a decrease in glutamate excitotoxicity. From these observations, we conclude that minocycline exerts neuroprotective effects independent of its anti-inflammatory properties. This hypothesis was confirmed in a non-inflammatory disease model leading to degeneration of RGCs, the surgical transection of the optic nerve.","no",NA,"WZ",1,NA,"EAE","rat","Brown Norway","female","9","Minocycline","control",1,24,"1,2",1.4,8,0.3,3,8,0.3,"mean, SEM",NA,NA,NA,NA,NA,NA,NA,NA,NA,NA,NA,NA,NA,NA,NA,NA,NA,NA,NA,NA,NA,NA,NA,NA,NA,NA,NA,NA,NA,NA,NA,NA,NA,NA,NA,NA,NA,NA,NA,NA,NA,NA,NA,NA,NA,NA,NA,NA,NA,NA,NA,NA,NA,NA,NA,"rat","Failed",NA,"","","","","","","","","","",NA,NA,NA,"EAE","41","optic neuritis","16","rats","24","mouse","5","female","histology","behaviour","not reported","not reported","No manual check required","yes","Manual check recommended","yes","Manual check recommended","not reported","No manual check required","not reported","No manual check required","not reported","No manual check required","not reported",NA,"kmaier@gwdg.de","1","44","74","184","28","74 - 765","1 - 1014"
"119","blind","101016jneurocience201510013",455,"Yazdi, A. and Baharvand, H. and Javan, M.",2015,"Neuroscience","Enhanced remyelination following lysolecithin-induced demyelination in mice under treatment with fingolimod (FTY720)","Multiple sclerosis (MS) is a chronic, progressive demyelinating disorder which affects the central nervous system (CNS) and is recognized as the major cause of nervous system disability in young adults. Enhancing myelin repair by stimulating endogenous progenitors is a main goal in efforts for MS treatment. Fingolimod (FTY720) which is administrated as an oral medicine for relapsing-remitting MS has direct effects on neural cells. In this study, we hypothesized if daily treatment with FTY720 enhances endogenous myelin repair in a model of local demyelination induced by lysolecithin (LPC). We examined the response of inflammatory cells as well as resident OPCs and evaluated the number of newly produced myelinating cells in animals which were under daily treatment with FTY720. FTY720 at doses 0.3 and 1mg/kg decreased the inflammation score at the site of LPC injection and decreased the extent of demyelination. FTY720 especially at the lower dose increased the number of remyelinated axons and newly produced myelinating cells. These data indicate that repetitive treatment with FTY720, behind an anti-inflammatory effect, exerts beneficial effects on the process of endogenous repair of demyelinating insults.","no",NA,"PH",1,NA,"lysolecithin","mouse","C57BL/6","male","9","Fingolimod","control",1,NA,"0",NA,NA,NA,NA,NA,NA,NA,NA,NA,NA,NA,NA,NA,NA,NA,NA,NA,NA,NA,NA,NA,NA,NA,NA,NA,NA,NA,NA,NA,NA,NA,NA,NA,NA,NA,NA,NA,NA,NA,NA,NA,NA,NA,NA,NA,NA,NA,NA,NA,NA,NA,NA,NA,NA,NA,NA,NA,NA,NA,NA,NA,NA,"mouse","Marketed",NA,"","","","","","","","","","",NA,NA,NA,"lysolecithin","5","EAE","4","mice","5","rat","2","male","histology","behaviour","imaging","not reported","No manual check required","yes","No manual check required","yes","Manual check recommended","yes","Manual check recommended","not reported","No manual check required","not reported","No manual check required","not reported","10.1016/j.neuroscience.2015.10.013","mjavan@modares.ac.ir","16","41","33","296","431","33 - 431","1 - 720"
"120","blind","101016jyexmp201705015",380,"Shirazi, H. A. and Rasouli, J. and Ciric, B. and Wei, D. and Rostami, A. and Zhang, G. X.",2017,"Experimental and Molecular Pathology","1,25-Dihydroxyvitamin D3 suppressed experimental autoimmune encephalomyelitis through both immunomodulation and oligodendrocyte maturation","1,25-Dihydroxyvitamin D3 (1,25(OH)2D3) has recently been found to have the anti-inflammatory potential to suppress experimental autoimmune encephalomyelitis (EAE), an animal model of multiple sclerosis; however, its direct effect on neural cells is not clear. In the current study we show that 1,25(OH)2D3 treatment effectively suppressed clinical signs of ongoing EAE and reduced inflammation and demyelination scores in the central nervous system (CNS). The treatment significantly decreased production/expression of pro-inflammatory cytokines IFN-<ce><b3>, GM-CSF and IL-17A, while it increased anti-inflammatory cytokines IL-4 and IL-10. Further, 1,25(OH)2D3 treatment effectively elevated the numbers of neural stem cells, oligodendrocyte precursor cells, as well as oligodendrocytes in disease lesions in the CNS. These results, together with its in vitro effect of inducing oligodendrocyte differentiation as shown in our previous findings, demonstrate that 1,25(OH)2D3 suppressed EAE not only by its immunomodulatory capacity, but also by its effect on oligodendrocyte differentiation and maturation, and thus has potential for remyelination and neural repair.","no",NA,"PH",1,NA,"EAE","mouse","C57BL/6","female","10","Vitamin D3","control",1,NA,"2",1.6,5,0.2,2.8,5,0.3,"mean, SEM",NA,NA,NA,NA,NA,NA,NA,NA,NA,NA,NA,NA,NA,NA,NA,NA,NA,NA,NA,NA,NA,NA,NA,NA,NA,NA,NA,NA,NA,NA,NA,NA,NA,NA,NA,NA,NA,NA,NA,NA,NA,NA,NA,NA,NA,NA,NA,NA,NA,NA,NA,NA,NA,NA,NA,"mouse","Failed",NA,"","","","","","","","","","",NA,NA,NA,"EAE","17","not reported","0","mice","18","mouse","2","female","histology","behaviour","not reported","not reported","No manual check required","yes","No manual check required","not reported","No manual check required","not reported","No manual check required","not reported","No manual check required","not reported","No manual check required","not reported",NA,NA,"11","25","81","177","230","81 - 230","1 - 424"
"121","blind","10103841551020006273",196,"Ishihara, A. and Ishihara, J. and Watkins, E. A. and Tremain, A. C. and Nguyen, M. and Solanki, A. and Katsumata, K. and Mansurov, A. and Budina, E. and Alpar, A. T. and Hosseinchi, P. and Maillat, L. and Reda, J. W. and Kageyama, T. and Swartz, M. A. and Yuba, E. and Hubbell, J. A.",2021,"Nat Biomed Eng","Prolonged residence of an albumin-IL-4 fusion protein in secondary lymphoid organs ameliorates experimental autoimmune encephalomyelitis","Interleukin-4 (IL-4) suppresses the development of multiple sclerosis in a murine model of experimental autoimmune encephalomyelitis (EAE). Here, we show that, in mice with EAE, the accumulation and persistence in the lymph nodes and spleen of a systemically administered serum albumin (SA)-IL-4 fusion protein leads to higher efficacy in preventing disease development than the administration of wild-type IL-4 or of the clinically approved drug fingolimod. We also show that the SA-IL-4 fusion protein prevents immune-cell infiltration in the spinal cord, decreases integrin expression in antigen-specific CD4(+) T cells, increases the number of granulocyte-like myeloid-derived suppressor cells (and their expression of programmed-death-ligand-1) in spinal cord-draining lymph nodes and decreases the number of T helper 17 cells, a pathogenic cell population in EAE. In mice with chronic EAE, SA-IL-4 inhibits immune-cell infiltration into the spinal cord and completely abrogates immune responses to myelin antigen in the spleen. The SA-IL-4 fusion protein may be prophylactically and therapeutically advantageous in the treatment of multiple sclerosis.","no",NA,"PH",1,NA,"EAE","mouse","C57BL/6","female","10.5","Fingolimod","control",1,NA,"1,2",2,7,0.3,2.4,7,0.2,"mean, SEM",NA,NA,NA,NA,NA,NA,NA,NA,NA,NA,NA,NA,NA,NA,NA,NA,NA,NA,NA,NA,NA,NA,NA,NA,NA,NA,NA,NA,NA,NA,NA,NA,NA,NA,NA,NA,NA,NA,NA,NA,NA,NA,NA,NA,NA,NA,NA,NA,NA,NA,NA,NA,NA,NA,NA,"mouse","Marketed",NA,"","","","","","","","","","",NA,NA,NA,"EAE","6","not reported","0","mouse","20","mice","14","female","histology","behaviour","not reported","not reported","No manual check required","yes","No manual check required","yes","No manual check required","yes","Manual check recommended","yes","Manual check recommended","not reported","No manual check required","yes",NA,"c(""j.ishihara@imperial.ac.uk"", ""jhubbell@uchicago.edu"")","1","482","1459","38","1107","1459 - 1755","1 - 2012"
"122","blind","101038nature01158",458,"Youssef, S. and St<c3><bc>ve, O. and Patarroyo, J. O. and Ruiz, P. J. and Radosevich, J. L. and Mi Hur, E. and Bravo, M. and Mitchell, D. J. and Sobel, R. A. and Stelnman, L. and Zamvil, S. S.",2002,"Nature","The HMG-CoA reductase inhibitor, atorvastatin, promotes a Th2 bias and reverses paralysis in central nervous system autoimmune disease","Statins, 3-hydroxy-3-methylglutaryl coenzyme A (HMG-CoA) reductase inhibitors, which are approved for cholesterol reduction, may also be beneficial in the treatment of inflammatory diseasest1-3. Atorvastatin (Lipitor) was tested in chronic and relapsing experimental autoimmune encephalomyelitis, a CD4+ Th1-mediated central nervous system (CNS) demyelinating disease model of multiple sclerosis4'5. Here we show that oral atorvastatin prevented or reversed chronic and relapsing paralysis. Atorvastatin induced STAT6 phosphorylation and secretion of Th2 cytokines (interleukin (IL)-4, IL-5 and IL-10) and transforming growth factor (TGF)-<ce><b2>. Conversely, STAT4 phosphorylation was inhibited and secretion of Th1 cytokines (IL-2, IL-12, interferon (IFN)-<ce><b3> and tumour necrosis factor (TNF)-<ce><b1>) was suppressed. Atorvastatin promoted differentiation of Th0 cells into Th2 cells. In adoptive transfer, these Th2 cells protected recipient mice from EAE induction. Atorvastatin reduced CNS infiltration and major histocompatibility complex (MHC) class II expression. Treatment of microglia inhibited IFNgamma;-inducible transcription at multiple MHC class II transactivator (CIITA) promoters and suppressed class II upregulation. Atorvastatin suppressed IFN<ce><b3>-inducible expression of CD40, CD80 and CD86 co-stimulatory molecules. L-Mevalonate, the product of HMG-CoA reductase, reversed atorvastatin's effects on antigen-presenting cells (APC) and T cells. Atorvastatin treatment of either APC or T cells suppressed antigen-specific T-cell activation. Thus, atorvastatin has pleiotropic immunomodulatory effects involving both APC and T-cell compartments. Statins may be beneficial for multiple sclerosis and other Th1-mediated autoimmune diseases.","no",NA,"PH",1,NA,"EAE","mouse","C57BL/6","female","9.5","Atorvastatin","control",1,NA,"0,1,2",0,7,0,2.2,7,1,"mean, SEM",NA,NA,NA,NA,NA,NA,NA,NA,NA,NA,NA,NA,NA,NA,NA,NA,NA,NA,NA,NA,NA,NA,NA,NA,NA,NA,NA,NA,NA,NA,NA,NA,NA,NA,NA,NA,NA,NA,NA,NA,NA,NA,NA,NA,NA,NA,NA,NA,NA,NA,NA,NA,NA,NA,NA,"mouse","Failed",NA,"","","","","","","","","","",NA,NA,NA,"EAE","3","experimental allergic encephalomyelitis","3","mice","21","mouse","14","female","histology","behaviour","not reported","not reported","No manual check required","yes","No manual check required","yes","Manual check recommended","yes","Manual check recommended","not reported","No manual check required","not reported","No manual check required","not reported","10.1038/nature01158.","c(""zhigang.he@tch.harvard.edu"", ""zamvil@itsa.ucsf.edu"")","1","1","436","232","3","436 - 690","1 - 690"
"123","blind","1010800161641220191650218",167,"Haghmorad, D. and Yazdanpanah, E. and Jadid Tavaf, M. and Zargarani, S. and Soltanmohammadi, A. and Mahmoudi, M. B. and Mahmoudi, M.",2019,"Neurol Res","Prevention and treatment of experimental autoimmune encephalomyelitis induced mice with 1, 25-dihydroxyvitamin D(3)","Multiple sclerosis (MS) is a complex inflammatory and demyelinating disease of the central nervous system (CNS) frequently starts in young adulthood. Demyelination, inflammatory and axonal damage in the CNS is the pathological hallmark of experimental autoimmune encephalomyelitis (EAE), an animal model of multiple sclerosis. 1, 25-dihydroxyvitamin D(3) (Vitamin D(3)) is involved in calcium regulation, phosphorus homeostasis, and bone mineralization. In addition, vitamin D(3) has potential inhibitory effects on immune cells in various inflammatory and autoimmunity disease. C57BL/6 female mice were divided into prevention groups (low, middle and high doses) and treatment groups (middle and high doses). Prevention groups received vitamin D(3) 2 weeks before EAE induction, and treatment groups were treated with vitamin D(3) simultaneous with EAE induction. Vitamin D(3) inhibits the development of EAE in a dose-dependent manner. Histological studies revealed reduced demyelination and limited infiltration into CNS, moreover vitamin D(3) increased the production of IL-4, IL-10, and TGF-<ce><b2>, while a significant reduction in the production of IFN-<ce><b3>, IL-6, TNF-<ce><b1>, and IL-17 was observed. Flow cytometry results for CD4(+) T cell subsets in compliance with ELISA cytokine assay results showed a significant decrease in the percentage of Th1 and Th17, but also a significant increase in the percentage of Th2 and Treg for middle and high dose vitamin D(3) treated mice. Real-time PCR results indicated that middle and high dose vitamin D(3) treatment reduced T-bet and ROR-<ce><b3>t expression, but enhanced GATA3 and Foxp3 expression. Real-Time PCR results in CNS for T cell subsets related cytokines and transcription factors supported the results of flow cytometry and ELISA. This study indicated that middle and high doses of vitamin D3 deviate the balance between Th1/Th2 and Th17/Treg to Th2 and Treg. Moreover, vitamin D3 could reduce the incidence and severity of EAE clinical disease.","no",NA,"PH",1,NA,"EAE","mouse","C57BL/6","female","10","Vitamin D3","control",1,51,"0,1",1.7,8,0.3,4.2,9,0.3,"mean, SEM",NA,NA,NA,NA,NA,NA,NA,NA,NA,NA,NA,NA,NA,NA,NA,NA,NA,NA,NA,NA,NA,NA,NA,NA,NA,NA,NA,NA,NA,NA,NA,NA,NA,NA,NA,NA,NA,NA,NA,NA,NA,NA,NA,NA,NA,NA,NA,NA,NA,NA,NA,NA,NA,NA,NA,"mouse","Failed",NA,"","","","","","","","","","",NA,NA,NA,"EAE","27","not reported","0","mice","24","mouse","2","female","histology","behaviour","not reported","not reported","No manual check required","yes","No manual check required","yes","No manual check required","yes","Manual check recommended","not reported","No manual check required","not reported","No manual check required","not reported",NA,"mahmoudim@mums.ac.ir","36","60","194","51","527","194 - 527","1 - 1033"
