"178","both","101016jjn201512011",68,"Brod, S. A.",2016,"J Neurol Sci","Ingested (oral) anti-IL-12/23 inhibits EAE","BACKGROUND: Blocking the activity of IL-12/23 can inhibit autoimmune diseases such as psoriasis. OBJECTIVE: We examined whether an antibody against IL-12/23, ustekinumab (UTZ) (Stelera<c2><ae>), used clinically in psoriasis would have similar anti-inflammatory effects in EAE after oral administration. DESIGN/METHODS: B6 mice were immunized with MOG peptide 35-55 and gavaged with isotype IgG control or UTZ during ongoing disease. Splenocytes, CD4(+) T cells or macrophages/monocyte lineage cells (CD11b(+)) from control fed or UTZ fed mice were adoptively transferred into active MOG peptide 35-55 immunized recipient mice during ongoing disease. Actively fed and recipient mice were examined for disease inhibition, inflammation, and cytokine responses. RESULTS: Ingested (oral) UTZ inhibited ongoing disease and decreased inflammation. Adoptively transferred cells from UTZ fed donors protected against actively induced disease and decreased inflammation. Oral UTZ decreased pro-inflammatory cytokines Th1-like cytokines IL-2, IL-12, IFN-<ce><b3>, IL-17 (Teff) and TNF-<ce><b1> in UTZ fed mice and increased counter-regulatory cytokines IL-4, IL-10 and IL-13 in recipients of donor cells from UTZ fed mice. CONCLUSIONS: Ingested (orally administered) UTZ can inhibit disease, CNS inflammation, decrease pro-inflammatory Th1-like and Th17 cytokines and increase Th2-like anti-inflammatory cytokines.","no",NA,"IEB",1,NA,"EAE","mouse","C57BL/6","female","7","Ustekinumab","control",1,NA,"2",1.2,8,0.25,2.5,8,0.25,"mean, SEM",NA,NA,NA,NA,NA,NA,NA,NA,NA,NA,NA,NA,NA,NA,NA,NA,NA,NA,NA,NA,NA,NA,NA,NA,NA,NA,NA,NA,NA,NA,NA,NA,NA,NA,NA,NA,NA,NA,NA,NA,NA,NA,NA,NA,NA,NA,NA,NA,NA,NA,NA,NA,NA,NA,NA,"mouse","Failed",NA,"unclear","unclear","unclear","unclear","unclear","low","unclear","unclear","unclear","unclear",NA,NA,NA,"EAE","10","experimental autoimmune encephalomyelitis","1","mice","44","mouse","11","female","histology","behaviour","not reported","yes","No manual check required","yes","Manual check recommended","not reported","No manual check required","yes","No manual check required","not reported","No manual check required","not reported","No manual check required","not reported","10.1016/j.jns.2015.12.011","sbrod@mac.com","8","27","42","139","304","42 - 304","1 - 586"
"179","both","101016jjneuroim200902016",85,"Chen, X. and Hu, X. and Zou, Y. and Pi, R. and Liu, M. and Wang, T. and Zheng, X. and Liu, M. and Lin, M. and Liu, P. and Tao, L.",2009,"J Neuroimmunol","Combined treatment with minocycline and prednisone attenuates experimental autoimmune encephalomyelitis in C57 BL/6 mice","There has been enormous progress in the treatment of multiple sclerosis (MS) in recent years, but further improvement in therapy is still required because not all patients respond optimally to existing treatments. Increasing evidence has demonstrated that combination therapies produce a more favorable clinical outcome than monotherapy in MS treatment. Minocycline is effective in experimental autoimmune encephalomyelitis (EAE), and is a promising candidate for future MS medication. Glucocorticosteroids (GCS) belong to the most potent immunosuppressive drugs and are the mainstay for treatment of acute relapses in MS. In this study, we tested whether the combination of minocycline and prednisone (a synthetic GCS) at suboptimal doses could produce synergistic effects in EAE. Our findings showed that the combination of these two drugs functioned better than when they were individually administered in EAE mice, as evidenced by decreased clinical scores, reduced inflammation and demyelination, and improved magnetic resonance imaging outcomes. Further studies revealed that the combined treatment prevented the reduction of brain-derived neurotrophic factor (BDNF) and nerve growth factor (NGF) mRNA expression in cerebral cortex of EAE mice. In conclusion, our findings indicated that this combination therapy suppressed disease severity of EAE partially through blocking the downregulation of neurotrophic factor expression, suggesting that the combination of minocycline and prednisone could be a novel treatment in MS.","no",NA,"IEB",1,NA,"EAE","mouse","C57BL/6","female","7","Minocycline","control",1,NA,"2",0.5,6,0.35,3.25,6,0.6,"mean, SEM",NA,NA,NA,NA,NA,NA,NA,NA,"MRI data: only indicated in a table if enhancement and/or focal lesions present (with ""+"" and ""-"")",NA,NA,NA,NA,NA,NA,NA,NA,NA,NA,NA,NA,NA,NA,NA,NA,NA,NA,NA,NA,NA,NA,NA,NA,NA,NA,NA,NA,NA,NA,NA,NA,NA,NA,NA,NA,NA,NA,NA,NA,NA,NA,NA,NA,NA,NA,"mouse","Failed",NA,"unclear","unclear","unclear","unclear","unclear","low","low","unclear","unclear","low",NA,NA,NA,"EAE","49","not reported","0","mice","73","mouse","9","female","histology","behaviour","imaging","yes","No manual check required","yes","Manual check recommended","not reported","No manual check required","not reported","No manual check required","not reported","No manual check required","not reported","No manual check required","not reported",NA,"huxueqiangzssy@yahoo.com.cn","17","37","77","71","293","77 - 293","1 - 470"
"180","both","101016jjneuroim201005039",87,"Chen, X. and Pi, R. and Liu, M. and Ma, X. and Jiang, Y. and Liu, Y. and Mao, X. and Hu, X.",2010,"J Neuroimmunol","Combination of methylprednisolone and minocycline synergistically improves experimental autoimmune encephalomyelitis in C57 BL/6 mice","Combination therapies with existing or novel drugs for multiple sclerosis (MS) have great clinical potential to improve MS treatment outcomes. Our previous studies had confirmed that the combined treatment of minocycline and prednisone produced beneficial effects partially through preventing the reduction of brain-derived neurotrophic factor and nerve growth factor mRNA expression in the cerebral cortex of experimental autoimmune encephalomyelitis (EAE) mice. As high-dose methylprednisolone administered intravenously has more superior efficacy than oral prednisone and had been provided as a stable therapy for MS patients at the onset of an acute relapse, we further evaluated the effects of combined methylprednisolone and minocycline at suboptimal doses on EAE mice at the acute stage in this study. Interferon gamma (IFN-<ce><b3>) and interleukin-4 (IL-4), the hallmark cytokines that direct Th1 and Th2 development and play an important role in the pathogenesis of MS as well as EAE, were also assayed. Obtained results showed that combined treatment could successfully attenuate severe clinical deficit and suppress histopathological events in EAE. In addition, reduced IFN-<ce><b3> and increased IL-4 production/expression were found in the splenocytes culture supernatants and brains of EAE mice by the combined treatment. Our data indicate that the combination of methylprednisolone and minocycline may be a promising therapy for MS.","no",NA,"IEB",1,NA,"EAE","mouse","C57BL/6","female","7","Minocycline","control",1,NA,"2",2.1,6,0.25,3.2,6,0.15,"mean, SEM",NA,NA,NA,NA,NA,NA,NA,NA,NA,NA,NA,NA,NA,NA,NA,NA,NA,NA,NA,NA,NA,NA,NA,NA,NA,NA,NA,NA,NA,NA,NA,NA,NA,NA,NA,NA,NA,NA,NA,NA,NA,NA,NA,NA,NA,NA,NA,NA,NA,NA,NA,NA,NA,NA,NA,"mouse","Failed",NA,"","","","","","","","","","",NA,NA,NA,"EAE","56","not reported","0","mice","58","not reported","NA","female","histology","behaviour","not reported","yes","No manual check required","yes","No manual check required","yes","No manual check required","not reported","No manual check required","not reported","No manual check required","not reported","No manual check required","not reported",NA,"huxueqiangzssy@yahoo.com.cn","13","32","68","60","244","68 - 244","1 - 477"
"181","both","101016jjneuroim201406001",184,"Hou, Y. and Heon Ryu, C. and Jun, J. A. and Kim, S. M. and Jeong, C. H. and Jeun, S. S.",2014,"J Neuroimmunol","Interferon ÃŽÂ²-secreting mesenchymal stem cells combined with minocycline attenuate experimental autoimmune encephalomyelitis","We previously demonstrated that interferon <ce><b2> (IFN-<ce><b2>)-secreting mesenchymal stem cells (MSCs-IFN-<ce><b2>) strongly reduced the clinical severity of experimental autoimmune encephalomyelitis (EAE), compared with MSCs alone. Recently, minocycline ameliorates the clinical severity of multiple sclerosis (MS). Herein, we evaluated the effects of a combined treatment of MSCs-IFN-<ce><b2> and minocycline on EAE mice. The combined treatment significantly alleviated the clinical severity mainly by maintaining the integrity of blood-spinal cord barrier, in a manner likely involving inhibition of microvascular disruption, matrix metalloproteinases, neuroinflammation, and enhancement of immunomodulatory effects. Therefore, this combined treatment has the potential to improve the functional recovery of patients with MS.","no",NA,"PH",1,NA,"EAE","mouse","C57BL/6","female","12","Minocycline","control",1,40,"2",1.8,10,0.4,3,10,0.6,"mean, SEM",NA,NA,NA,NA,NA,NA,NA,NA,NA,NA,NA,NA,NA,NA,NA,NA,NA,NA,NA,NA,NA,NA,NA,NA,NA,NA,NA,NA,NA,NA,NA,NA,NA,NA,NA,NA,NA,NA,NA,NA,NA,NA,NA,NA,NA,NA,NA,NA,NA,NA,NA,NA,NA,NA,NA,"mouse","Failed",NA,"","","","","","","","","","",NA,NA,NA,"EAE","26","not reported","0","mice","43","mouse","6","female","histology","behaviour","not reported","yes","No manual check required","yes","No manual check required","yes","Manual check recommended","not reported","No manual check required","not reported","No manual check required","not reported","No manual check required","not reported",NA,"ssjeun@catholic.ac.kr","14","29","78","73","292","78 - 292","1 - 481"
"182","both","101016jjneuroim201506006",28,"Alme, M. N. and Nystad, A. E. and B<c3><b8>, L. and Myhr, K. M. and Vedeler, C. A. and Wergeland, S. and Torkildsen, <c3><98>",2015,"J Neuroimmunol","Fingolimod does not enhance cerebellar remyelination in the cuprizone model","Fingolimod (FTY720) is approved for treatment of relapsing-remitting multiple sclerosis. In vitro studies have found that fingolimod stimulates remyelination in cerebellar slices, but in vivo animal studies have not detected any positive effect on cerebral remyelination. The discrepant findings could be a result of different mechanisms underlying cerebral and cerebellar remyelination. The cuprizone model for de- and remyelination was used to evaluate whether fingolimod had an impact on cerebellar remyelination in vivo. We found that fingolimod did not have any effect on cerebellar remyelination, number of mature oligodendrocytes, microglia or astrocytes when fed after cuprizone exposure.","no",NA,"IEB",1,NA,"cuprizone","mouse","C57BL/6","female","5","Fingolimod","control",0,32,"2",NA,NA,NA,NA,NA,NA,NA,NA,NA,NA,NA,NA,NA,NA,NA,NA,NA,NA,NA,NA,NA,NA,NA,NA,NA,NA,NA,NA,NA,NA,NA,NA,NA,NA,NA,NA,NA,NA,NA,NA,NA,NA,NA,NA,NA,NA,NA,NA,NA,NA,NA,NA,NA,NA,NA,NA,NA,NA,NA,NA,NA,NA,"mouse","Marketed",NA,"","","","","","","","","","",NA,NA,NA,"cuprizone","25","not reported","0","mice","8","mouse","5","female","histology","not reported","not reported","yes","No manual check required","yes","No manual check required","yes","Manual check recommended","yes","No manual check required","not reported","No manual check required","not reported","No manual check required","not reported","10.1016/j.jneuroim.2015.06.006","c(""maria.alme@uib.no"", ""Agnes.elisabeth.nystad@helse-bergen.no"", ""lars.bo@helse-bergen.no"", ""kjell-morten.myhr@helse-bergen.no"", ""christian.alexander.vedeler@helse-bergen.no"", ""stig.wergeland@helse-bergen.no"", ""oivind.torkildsen@helse-bergen.no"")","17","32","51","105","204","51 - 204","1 - 399"
"183","both","101016jjneuroim201612010",322,"Pant, A. B. and Wang, Y. and Mielcarz, D. W. and Kasper, E. J. and Telesford, K. M. and Mishra, M. and Haque, A. and Channon, J. Y. and Kasper, L. H. and Begum-Haque, S.",2017,"Journal of Neuroimmunology","Alteration of CD39Ã‚ +Ã‚ Foxp3Ã‚ + CD4 T cell and cytokine levels in EAE/MS following anti-CD52 treatment","While examining the therapeutic value of anti-CD52 antibody against EAE/MS, we identified a unique subset of CD39 + Tregs in repopulating GALT tissues, a major lymphoid reservoir, which was accompanied by amelioration of disease. Furthermore, anti-CD52 treatment leads to increased expression of BDNF, IL-10, and SMAD3 in the brains of EAE mice. This condition is associated with suppression of IL-17, a critical inflammatory factor in EAE/MS progression. Additionally, we found elevated levels of CD4 + CD39 + Tregs in PBMCs of RRMS patients treated with humanized anti-CD52 mAb. Thus, anti-CD52 can affect multiple immune mediated pathways involved in the pathogenesis of EAE/MS.","no",NA,"IEB, WZ, PH",1,NA,"EAE","mouse","C57BL/6",NA,"10","Alemtuzumab","control",1,NA,"2",0.6,14.5,0,3.25,14.5,0.3,"mean, SEM",NA,NA,NA,NA,NA,NA,NA,NA,NA,NA,NA,NA,NA,NA,NA,NA,NA,NA,NA,NA,NA,NA,NA,NA,NA,NA,NA,NA,NA,NA,NA,NA,NA,NA,NA,NA,NA,NA,NA,NA,NA,NA,NA,NA,NA,NA,NA,NA,NA,NA,NA,NA,NA,NA,NA,"mouse","Marketed",NA,"unclear","unclear","unclear","unclear","low","low","low","unclear","unclear","high",NA,NA,NA,"EAE","43","not reported","0","mice","40","mouse","5","female","histology","behaviour","not reported","yes","Manual check recommended","yes","Manual check recommended","yes","No manual check required","not reported","No manual check required","not reported","No manual check required","not reported","No manual check required","not reported",NA,"Azizul.Haque@Dartmouth.Edu","10","25","110","272","377","110 - 377","1 - 624"
"184","both","101016jjneuroim201802016",478,"Smith, P. A. and Schmid, C. and Zurbruegg, S. and Jivkov, M. and Doelemeyer, A. and Theil, D. and Dubost, V. and Beckmann, N.",2018,"J Neuroimmunol","Fingolimod inhibits brain atrophy and promotes brain-derived neurotrophic factor in an animal model of multiple sclerosis","Longitudinal brain atrophy quantification is a critical efficacy measurement in multiple sclerosis (MS) clinical trials and the determination of No Evidence of Disease Activity (NEDA). Utilising fingolimod as a clinically validated therapy we evaluated the use of repeated brain tissue volume measures during chronic experimental autoimmune encephalomyelitis (EAE) as a new preclinical efficacy measure. Brain volume changes were quantified using magnetic resonance imaging (MRI) at 7<e2><80><af>Tesla and correlated to treatment-induced brain derived neurotrophic factor (BDNF) measured in blood, cerebrospinal fluid, spinal cord and brain. Serial brain MRI measurements revealed slow progressive brain volume loss in vehicle treated EAE mice despite a stable clinical score. Fingolimod (1<e2><80><af>mg/kg) significantly ameliorated brain tissue atrophy in the cerebellum and striatum when administered from established EAE disease onwards. Fingolimod-dependent tissue preservation was associated with induction of BDNF specifically within the brain and co-localized with neuronal soma. In contrast, therapeutic teriflunomide (3<e2><80><af>mg/kg) treatment failed to inhibit CNS autoimmune mediated brain degeneration. Finally, weekly anti-IL-17A antibody (15<e2><80><af>mg/kg) treatment was highly efficacious and preserved whole brain, cerebellum and striatum volume. Fingolimod-mediated BDNF increases within the CNS may contribute to limiting progressive tissue loss during chronic neuroinflammation.","yes",NA,"PH",1,NA,"EAE","mouse","C57BL/6","female",NA,"Teriflunomide","control",1,NA,"2",NA,NA,NA,NA,NA,NA,NA,0.95,11,0.02,0.97,11,0.01,"mean, SEM","brain volume","MRI Data in percen. This row represents a study that appears in another row. However here only the MRI data corrresponding to teriflunomide are listed.",NA,NA,NA,NA,NA,NA,NA,NA,NA,NA,NA,NA,NA,NA,NA,NA,NA,NA,NA,NA,NA,NA,NA,NA,NA,NA,NA,NA,NA,NA,NA,NA,NA,NA,NA,NA,NA,NA,NA,NA,NA,NA,NA,NA,NA,NA,"mouse","Marketed",NA,"","","","","","","","","","",NA,NA,NA,"EAE","16","not reported","0","mice","14","mouse","4","female","histology","behaviour","imaging","yes","Manual check recommended","yes","No manual check required","yes","Manual check recommended","yes","No manual check required","not reported","No manual check required","not reported","No manual check required","not reported",NA,"c(""paul010976@gmail.com"", ""cindy.schmid@novartis.com"", ""stefan.zurbruegg@novartis.com"", ""magali.jivkov@novartis.com"", ""arno.doelemeyer@novartis.com"", ""diethilde.theil@novartis.com"", ""valerie.dubost@novartis.com"", ""nicolau.beckmann@novartis.com"")","19","36","104","280","417","104 - 417","1 - 813"
"185","both","101016jjneuroim201802016",388,"Smith, P. A. and Schmid, C. and Zurbruegg, S. and Jivkov, M. and Doelemeyer, A. and Theil, D. and Dubost, V. and Beckmann, N.",2018,"J Neuroimmunol","Fingolimod inhibits brain atrophy and promotes brain-derived neurotrophic factor in an animal model of multiple sclerosis","Longitudinal brain atrophy quantification is a critical efficacy measurement in multiple sclerosis (MS) clinical trials and the determination of No Evidence of Disease Activity (NEDA). Utilising fingolimod as a clinically validated therapy we evaluated the use of repeated brain tissue volume measures during chronic experimental autoimmune encephalomyelitis (EAE) as a new preclinical efficacy measure. Brain volume changes were quantified using magnetic resonance imaging (MRI) at 7<e2><80><af>Tesla and correlated to treatment-induced brain derived neurotrophic factor (BDNF) measured in blood, cerebrospinal fluid, spinal cord and brain. Serial brain MRI measurements revealed slow progressive brain volume loss in vehicle treated EAE mice despite a stable clinical score. Fingolimod (1<e2><80><af>mg/kg) significantly ameliorated brain tissue atrophy in the cerebellum and striatum when administered from established EAE disease onwards. Fingolimod-dependent tissue preservation was associated with induction of BDNF specifically within the brain and co-localized with neuronal soma. In contrast, therapeutic teriflunomide (3<e2><80><af>mg/kg) treatment failed to inhibit CNS autoimmune mediated brain degeneration. Finally, weekly anti-IL-17A antibody (15<e2><80><af>mg/kg) treatment was highly efficacious and preserved whole brain, cerebellum and striatum volume. Fingolimod-mediated BDNF increases within the CNS may contribute to limiting progressive tissue loss during chronic neuroinflammation.","no",NA,"PH",1,NA,"EAE","mouse","C57BL/6","female",NA,"Fingolimod","control",1,NA,"2",2,11,0.2,2.8,11,0.1,"mean, SEM",0.99,11,0.01,1.01,11,0.01,"mean, SEM","brain volume","EAE score data from study end (no graph available), MRI Data in percent","Teriflunomide",2,"2",2.2,9,0.1,2.5,9,0.1,"mean, SEM",NA,NA,NA,NA,NA,NA,NA,NA,NA,NA,NA,0.95,11,0.02,0.97,11,0.01,"mean, SEM","brain volume",NA,NA,NA,NA,NA,NA,NA,NA,NA,NA,NA,NA,NA,NA,NA,NA,NA,"mouse","Marketed","Marketed","","","","","","","","","","",NA,NA,NA,"EAE","16","not reported","0","mice","14","mouse","4","female","histology","behaviour","imaging","yes","Manual check recommended","yes","No manual check required","yes","Manual check recommended","yes","No manual check required","not reported","No manual check required","not reported","No manual check required","not reported",NA,"c(""paul010976@gmail.com"", ""cindy.schmid@novartis.com"", ""stefan.zurbruegg@novartis.com"", ""magali.jivkov@novartis.com"", ""arno.doelemeyer@novartis.com"", ""diethilde.theil@novartis.com"", ""valerie.dubost@novartis.com"", ""nicolau.beckmann@novartis.com"")","19","36","104","280","417","104 - 417","1 - 813"
"186","both","101016jjneuroim2020577163",101,"das Neves, S. P. and Santos, G. and Barros, C. and Pereira, D. R. and Ferreira, R. and Mota, C. and Monteiro, S. and Fernandes, A. and Marques, F. and Cerqueira, J. J.",2020,"J Neuroimmunol","Enhanced cognitive performance in experimental autoimmune encephalomyelitis mice treated with dimethyl fumarate after the appearance of disease symptoms","In multiple sclerosis (MS), cognitive dysfunction is common but difficult to treat. We analyzed the impact of dimethyl fumarate, an MS drug with neuroprotective properties, in spatial memory performance in a mouse model of MS and looked for structural correlates in the hippocampus. Treated mice presented better cognitive performance which was not associated with structural hippocampal damage but with decreased demyelination in the fimbria. Dimethyl fumarate, even if initiated after hindlimb paralysis, ameliorated memory deficits in the MS mouse model due, at least in part, to its positive impact in the demyelination of the main hippocampal output pathway.","no",NA,"IEB",1,NA,"EAE","mouse","C57BL/6","female","10","Dimethyl fumarate","control",1,NA,"2",2,22,0.3,2.7,20,0.25,"mean, SEM",NA,NA,NA,NA,NA,NA,NA,NA,NA,NA,NA,NA,NA,NA,NA,NA,NA,NA,NA,NA,NA,NA,NA,NA,NA,NA,NA,NA,NA,NA,NA,NA,NA,NA,NA,NA,NA,NA,NA,NA,NA,NA,NA,NA,NA,NA,NA,NA,NA,NA,NA,NA,NA,NA,NA,"mouse","Marketed",NA,"","","","","","","","","","",NA,NA,NA,"EAE","45","not reported","0","mice","14","rabbit","4","female","histology","behaviour","not reported","yes","No manual check required","yes","Manual check recommended","yes","No manual check required","not reported","No manual check required","not reported","No manual check required","not reported","No manual check required","not reported",NA,"jcerqueira@med.uminho.pt","22","33","83","45","534","83 - 534","1 - 843"
"187","both","101016jjneuroim2020577429",409,"Sun, H. and Wang, J. and Guo, L. and Wang, Y. and Zhang, J. and Wang, J. and Quan, M. and Li, B.",2021,"Journal of Neuroimmunology","The combined treatment of NAD+ and atorvastatin ameliorates the development of experimental autoimmune encephalomyelitis in C57BL/6 mice","Multiple sclerosis (MS) is a demyelinating and degenerating disorder of the central nervous system impacting many patients worldwide. Due to the complex pathogenesis of MS, drugs to treat MS often show partial effectiveness. Earlier experiments have demonstrated that both atorvastatin and nicotinamide adenine dinucleotide (NAD+) may ameliorate experimental autoimmune encephalomyelitis (EAE), which is known as a classical model of MS, via different protective mechanisms. Since combination therapy can exhibit more beneficial effects than monotherapy, we observed the protective effects of combined treatment of atorvastatin and NAD+ in EAE mice. Our results showed that the combined treatment of these two drugs at half of their optimal dosages had synergistic effect to alleviate the severity of EAE in mice than treatment with each alone. The combined treatment of EAE mice with atorvastatin plus NAD+ relieved the clinical signs and histologic changes, increased the proportion of Treg cells, attenuated IL-17 production, reduced proinflammatory cytokine secretion of Th17 cells, and increased cytokine secretion of Treg cells. In addition, the combined treatment also diminished phosphorylation of both P38 MAPK and ERK, while elevated SIRT1 expression. Taken together, these data suggested that combined treatment with NAD+ and atorvastatin could attenuate the progression of EAE by synergistic immune regulation.","no",NA,"PH",1,NA,"EAE","mouse","C57BL/6","female","9","Atorvastatin","control",1,36,"1",4,9,0.1,9,9,0.3,"mean, SD",NA,NA,NA,NA,NA,NA,NA,NA,"clinical score in a range of 0-15",NA,NA,NA,NA,NA,NA,NA,NA,NA,NA,NA,NA,NA,NA,NA,NA,NA,NA,NA,NA,NA,NA,NA,NA,NA,NA,NA,NA,NA,NA,NA,NA,NA,NA,NA,NA,NA,NA,NA,NA,NA,NA,NA,NA,NA,NA,"mouse","Failed",NA,"","","","","","","","","","",NA,NA,NA,"EAE","53","not reported","0","mice","67","not reported","NA","female","histology","behaviour","not reported","yes","No manual check required","yes","Manual check recommended","yes","Manual check recommended","yes","No manual check required","not reported","No manual check required","not reported","No manual check required","not reported",NA,"jack511@163.com","14","32","107","71","426","107 - 426","1 - 731"
"188","both","101016jjneuroim2021577583",183,"Hou, H. and Sun, Y. and Miao, J. and Gao, M. and Guo, L. and Song, X.",2021,"J Neuroimmunol","Ponesimod modulates the Th1/Th17/Treg cell balance and ameliorates disease in experimental autoimmune encephalomyelitis","Sphingosine-1-phosphate receptor 1 (S1P1) plays an important role in autoimmune disease. Here, we evaluated whether ponesimod, an S1P1 modulator, affects inflammation in experimental autoimmune encephalomyelitis (EAE) and investigated Th1/Th2/Th17/Treg cell subsets. Ponesimod treatment ameliorated EAE and alleviated inflammatory infiltration. Compared with untreated EAE, ponesimod-treated mice had lower Th1 and Th17 cell numbers and higher Treg cell numbers; their IFN-<ce><b3>, T-bet, IL-17, and ROR<ce><b3>t levels as well as their pmTOR/mTOR ratio were diminished, while their TGF-<ce><b2> and Foxp3 levels were enhanced. These results suggest that ponesimod modulates the Th1/Th17/Treg balance and regulates the mTOR pathway.","no",NA,"PH",1,NA,"EAE","mouse","C57BL/6","female","9","Ponesimod","control",1,75,"1",0.1,10,0.3,2.4,10,0.3,"mean, SD",NA,NA,NA,NA,NA,NA,NA,NA,NA,NA,NA,NA,NA,NA,NA,NA,NA,NA,NA,NA,NA,NA,NA,NA,NA,NA,NA,NA,NA,NA,NA,NA,NA,NA,NA,NA,NA,NA,NA,NA,NA,NA,NA,NA,NA,NA,NA,NA,NA,NA,NA,NA,NA,NA,NA,"mouse","Marketed",NA,"","","","","","","","","","",NA,NA,NA,"EAE","28","not reported","0","mice","25","mouse","2","female","histology","behaviour","not reported","yes","Manual check recommended","yes","No manual check required","yes","Manual check recommended","not reported","No manual check required","not reported","No manual check required","not reported","No manual check required","not reported","10.1016/j.jneuroim.2021.577583","songxiujuan1@126.com","14","25","40","112","280","40 - 280","1 - 480"
